{
  "status": "committed",
  "protocol": "shortcuts-1",
  "server_generation": "00000000-0000-4000-8000-000000000004",
  "publisher_epoch": "00000000-0000-4000-8000-000000000005",
  "plan_id": "00000000-0000-4000-8000-000000000001",
  "job_id": "00000000-0000-4000-8000-000000000002",
  "attempt_id": "00000000-0000-4000-8000-000000000030",
  "snapshot_id": "00000000-0000-4000-8000-000000000031",
  "received_count": 0,
  "stored_count": 0,
  "read_state": "no_visible_data",
  "observation_revision": 4,
  "projection_state": "pending"
}
